<?xml version="1.0" encoding="UTF-8"?>
<xs:schema xmlns:xs="http://www.w3.org/2001/XMLSchema">
  <xs:element name="tickets">
    <xs:complexType>
      <xs:sequence>
        <xs:element name="ticket" minOccurs="0" maxOccurs="unbounded">
          <xs:complexType>
            <xs:sequence>
              <xs:element name="category" type="xs:string"/>
              <xs:element name="clientId" type="xs:integer"/>
              <xs:element name="messages">
                <xs:complexType>
                  <xs:sequence>
                    <xs:element name="supportMsg" maxOccurs="unbounded">
                      <xs:complexType>
                        <xs:simpleContent>
                          <xs:extension base="xs:string">
                            <xs:attribute name="userId" type="xs:integer" use="required"/>
                            <xs:attribute name="dateTime" type="dateTime" use="required"/>
                          </xs:extension>
                        </xs:simpleContent>
                      </xs:complexType>
                    </xs:element>
                  </xs:sequence>
                </xs:complexType>
              </xs:element>
            </xs:sequence>
            <xs:attribute name="id" type="xs:integer" use="required"/>
            <xs:attribute name="date" type="xs:date" use="required"/>
            <xs:attribute name="status" type="status" use="required"/>
          </xs:complexType>
        </xs:element>
      </xs:sequence>
    </xs:complexType>
  </xs:element>
  <xs:simpleType name="status">
    <xs:restriction base="xs:string">
      <xs:enumeration value="open"/>
      <xs:enumeration value="resolved"/>
    </xs:restriction>
  </xs:simpleType>
  <xs:simpleType name="dateTime">
    <xs:restriction base="xs:string">
      <xs:pattern value="\d{4}-\d{2}-\d{2} \d{2}:\d{2}:\d{2}"/>
    </xs:restriction>
  </xs:simpleType>
</xs:schema>
